node_1|node_2|edge|chunk_id|node_ 1|Edge
pandemic accord|vulnerable people's needs|consideration in pandemics|0f7ab32f99de49388ec7f47d55f62bc0||
pandemic accord|public health and healthcare systems development|commitment|0f7ab32f99de49388ec7f47d55f62bc0||
pandemic accord|protect staff|risk in epidemics and pandemics|0f7ab32f99de49388ec7f47d55f62bc0||
public health|healthcare systems|Related to|22cc304d163540089e2e574688718ab6||
staff protection|epidemics and pandemics|Involved in|22cc304d163540089e2e574688718ab6||
public communication|misinformation|Addressing|22cc304d163540089e2e574688718ab6||
whole-of-society approach|plans and actions|Involved in|22cc304d163540089e2e574688718ab6||
global coordination|commitment|Requires|22cc304d163540089e2e574688718ab6||
preparedness plans|all of government|Involve|22cc304d163540089e2e574688718ab6||
regular simulation exercises|preparedness plans|Part of|22cc304d163540089e2e574688718ab6||
universal health and preparedness review|review mechanism|For each country's preparedness|22cc304d163540089e2e574688718ab6||
peer review|plans assessment|Involved in|22cc304d163540089e2e574688718ab6||
independent assessment|plans assessment|Also involved in|22cc304d163540089e2e574688718ab6||
public health response|ihr|Presumably falls under|22cc304d163540089e2e574688718ab6||
prevention|human and animal health|relates to|5aaf419340ed446388c170a975494f36||
zoonoses|reduce transmission|cause of concern|5aaf419340ed446388c170a975494f36||
wet markets closure or banning exotic animal trade|prevention measures|counter-measure to zoonoses|5aaf419340ed446388c170a975494f36||
joint plan of action|one health approach|initiative by various organizations|5aaf419340ed446388c170a975494f36||
quadripartite|global health equity|working to address the issues|5aaf419340ed446388c170a975494f36||
equity|access to vaccines, drugs, and medical equipment|area of contention in member states|5aaf419340ed446388c170a975494f36||
developing countries|wider spread of manufacturing|seeking for vaccine production|5aaf419340ed446388c170a975494f36||
south africa|success in mrna vaccine manufacturing|example to follow for others|5aaf419340ed446388c170a975494f36||
financial investment|technology transfer|required by pharmaceutical industry|7e4472e16355427eac7ca4ad2ad540a6||
pharmaceutical industry|wealthier governments|funding R&D|7e4472e16355427eac7ca4ad2ad540a6||
pharmaceutical industry|poorer countries|vaccine distribution|7e4472e16355427eac7ca4ad2ad540a6||
pharmaceutical industry|commercial pricing|incentive for innovation|7e4472e16355427eac7ca4ad2ad540a6||
infectious diseases|animals|transfer between species|7e4472e16355427eac7ca4ad2ad540a6||
pandemic accord|world trade organization|struggled to reach agreement|c7a99ed0afc64ddd846b914246743dd2||
trips|public health emergency|relationship for drugs accessibility|c7a99ed0afc64ddd846b914246743dd2||
developing countries|equity of access|insistence on new Accord|c7a99ed0afc64ddd846b914246743dd2||
pandemic accord|ihr|failure condition|c7a99ed0afc64ddd846b914246743dd2||
pandemic accord|financing|crucial gap|c7a99ed0afc64ddd846b914246743dd2||
g20 independent high-level panel|annual financing need|estimated requirement|c7a99ed0afc64ddd846b914246743dd2||
pandemic fund|world bank|established at|c7a99ed0afc64ddd846b914246743dd2||
promised funding|first year|US$ 1.6 billion received|c7a99ed0afc64ddd846b914246743dd2||
promised funding|us$ 1.6 billion|Amount|7aa12dbfbe994dec81d06c120a98f78a||
funds|raised in the longer term|Timeframe|7aa12dbfbe994dec81d06c120a98f78a||
g20|deliberate on necessary financing|Role|7aa12dbfbe994dec81d06c120a98f78a||
accountability|obligations in the accord and ihr|Subject of Accountability|7aa12dbfbe994dec81d06c120a98f78a||
external accountability mechanisms|safeguards to ensure obligations|Role of External Mechanisms|7aa12dbfbe994dec81d06c120a98f78a||
the panel|independent assessment of countries|Role in Assessment|7aa12dbfbe994dec81d06c120a98f78a||
who|friend and supporter of countries||7aa12dbfbe994dec81d06c120a98f78a||Supporting Relationship
accelerating global health|pathways to health equity for the g20|is related to|a89658b132ad4547a1efc0cfad4cfcec||
panel|g20|belongs to|a89658b132ad4547a1efc0cfad4cfcec||
arms-length independent assessment body|who|will be hosted by|a89658b132ad4547a1efc0cfad4cfcec||
international atomic energy agency (iaea)|model being proposed|is for the independent assessment body|a89658b132ad4547a1efc0cfad4cfcec||
who|has much of the monitoring information|for the independent assessment body|a89658b132ad4547a1efc0cfad4cfcec||
public space|challenge them in|is the way forward|a89658b132ad4547a1efc0cfad4cfcec||
accord and perhaps the ihr, too|way forward|is a small independent body for|a89658b132ad4547a1efc0cfad4cfcec||
arms-length independent assessment body|housed within the accord’s treaty structure|could be|a89658b132ad4547a1efc0cfad4cfcec||
dame barbara stocking|panel for a global public health convention,|is responsible for opinions expressed in this article|a89658b132ad4547a1efc0cfad4cfcec||
dame barbara stocking|panel’s discussions|are informed by|a89658b132ad4547a1efc0cfad4cfcec||
covid-19 pandemic|future disease outbreaks|cause and effect|fabf903dfe89474ca6029b0a5e34f595||
climate change|global infectious disease outbreaks|contributing factor|fabf903dfe89474ca6029b0a5e34f595||
unabated encroachment on habitats of wild animals|future, potentially more menacing global infectious disease outbreaks|cause and effect|fabf903dfe89474ca6029b0a5e34f595||
population growth|future, potentially more menacing global infectious disease outbreaks|cause and effect|fabf903dfe89474ca6029b0a5e34f595||
urbanisation|future, potentially more menacing global infectious disease outbreaks|cause and effect|fabf903dfe89474ca6029b0a5e34f595||
covid-19 pandemic|emotional, physical, economic, social scars|result|fabf903dfe89474ca6029b0a5e34f595||
political will|taking stock of lessons from covid-19|need for|fabf903dfe89474ca6029b0a5e34f595||
pandemic preparedness and response|sars-cov-2|cause of the pandemic|3ee93735b86a4c618f12653e0f3c4db0||
health systems|strong|assumed by many countries|3ee93735b86a4c618f12653e0f3c4db0||
health services|vital health services|delivered during pandemic|3ee93735b86a4c618f12653e0f3c4db0||
global health experts|world’s vulnerability to a crisis of such magnitude|warned about|3ee93735b86a4c618f12653e0f3c4db0||
gaps in health security systems globally|covid-19|exploited the gaps|3ee93735b86a4c618f12653e0f3c4db0||
office of the covax facility|managing director|speaks from experience|3ee93735b86a4c618f12653e0f3c4db0||
access to covid-19 tools accelerator (act-a)|global collaboration|focused on accelerating development, production, and access to vaccines|3ee93735b86a4c618f12653e0f3c4db0||
covax|vaccines|facilitated through ACT-A|3ee93735b86a4c618f12653e0f3c4db0||
covax|accelerating development, production, and access to vaccines|goal|6d3b267a64e4447380d861e2af2085b7||
covax|vaccine pillar of act-a|part of|6d3b267a64e4447380d861e2af2085b7||
covax|delivered nearly 2 billion doses to 146 countries worldwide|result|6d3b267a64e4447380d861e2af2085b7||
covax|collaborative work of cepi, who, unicef, and gavi|partners|6d3b267a64e4447380d861e2af2085b7||
covax|prevented 2.7 million deaths worldwide|outcome|6d3b267a64e4447380d861e2af2085b7||
covax|could have made greater impact|potential|6d3b267a64e4447380d861e2af2085b7||
covax|three categories of lessons emerged from pandemic|context|6d3b267a64e4447380d861e2af2085b7||
covax|global health organisations|initiated by|7bb65fb349424e1db705103fc033b0df||
vaccine makers|sovereign governments|priority customers of|7bb65fb349424e1db705103fc033b0df||
export bans on vaccines|countries|imposed by|7bb65fb349424e1db705103fc033b0df||
covid-19|geopolitical reality|response to|b756f59ae9c846d4b8cd180fdab678a9||
contingent funding|global health agencies|support for|b756f59ae9c846d4b8cd180fdab678a9||
future version of the covax facility|global response|implementation by|b756f59ae9c846d4b8cd180fdab678a9||
funding|flexible and agile|nature of|b756f59ae9c846d4b8cd180fdab678a9||
mechanisms|working assumptions|updating for|b756f59ae9c846d4b8cd180fdab678a9||
at-risk investments|multiple scenarios|for|b756f59ae9c846d4b8cd180fdab678a9||
funding proportion|high-risk appetite|used for|b756f59ae9c846d4b8cd180fdab678a9||
covax|pandemic vaccine pool (pvp)|financing mechanism|71ad7c0227f24ca38c4803f7f8cf8f8e||
pandemic vaccine pool (pvp)|lower-income countries|procurement of vaccines|71ad7c0227f24ca38c4803f7f8cf8f8e||
covax|new innovations|crisis management|71ad7c0227f24ca38c4803f7f8cf8f8e||
new innovations|indemnification and liability agreements|critical to removing bottlenecks|71ad7c0227f24ca38c4803f7f8cf8f8e||
covax|future responses|important features|71ad7c0227f24ca38c4803f7f8cf8f8e||
multinational trade-facilitation measures|free flow of vaccines, manufacturing supplies|health emergencies|71ad7c0227f24ca38c4803f7f8cf8f8e||
agencies involved in the global health response|ship life-saving medical countermeasures and materials|low- and middle-income countries, humanitarian situations|71ad7c0227f24ca38c4803f7f8cf8f8e||
vaccines|health systems|strong, reliable|71ad7c0227f24ca38c4803f7f8cf8f8e||
health systems|shots in people's arms|requirements|2067070d62214af186e8acbe3592ef65||
complete end-to-end solutions|investments|backed by|2067070d62214af186e8acbe3592ef65||
early r&d|securing deals|requirements|2067070d62214af186e8acbe3592ef65||
consistent policy guidance|setting up operational, logistical, regulatory, and legal frameworks|further along the value chain|2067070d62214af186e8acbe3592ef65||
vaccines|ancillary supplies|not just|2067070d62214af186e8acbe3592ef65||
international freight and logistics|in-country delivery requirements|including personal protective equipment for healthcare workers|2067070d62214af186e8acbe3592ef65||
countries without infrastructure|doses to people who needed them|strained|2067070d62214af186e8acbe3592ef65||
challenge|countries with organisations like gavi and who|though still serious|2067070d62214af186e8acbe3592ef65||
significant resources|strengthen health systems|particularly primary health care|2067070d62214af186e8acbe3592ef65||
accelerating global health|pathways to health equity for g20|category|ce903a70fac544b9beac7468f519c9eb||
improvement of lower-income countries’ routine immunisation programmes since 2000|gavi|related organization|ce903a70fac544b9beac7468f519c9eb||
efforts to vaccinate mostly children|burden of delivering covid-19 vaccines to other populations|contrast|ce903a70fac544b9beac7468f519c9eb||
extra burden of delivering covid-19 vaccines|many showed relatively little decline in routine immunisation|cause and effect|ce903a70fac544b9beac7468f519c9eb||
pushing systems to the limit|vaccinators, doctors, nurses were burned out|result|ce903a70fac544b9beac7468f519c9eb||
responding to pandemic|delivering three times the number of vaccines compared with previous years|action|ce903a70fac544b9beac7468f519c9eb||
immunisation in gavi-implementing countries|suffered declines of only 4 percent in 2020 and 1 percent in 2021|outcome|ce903a70fac544b9beac7468f519c9eb||
return to pre-covid levels by the end of 2022|lot more resilience than expected|comparison|ce903a70fac544b9beac7468f519c9eb||
years of health system strengthening investments|countries will need more|requirement|ce903a70fac544b9beac7468f519c9eb||
building out primary healthcare services, cold chain, vaccine track-and-trace, human resources and data monitoring systems|reach all their citizens, especially those with the least access to healthcare|future action|ce903a70fac544b9beac7468f519c9eb||
covid-19 vaccine delivery support (cds)|service delivery|related to|54286a988fb7490d9a86d8da96b43249||
covid-19 vaccine delivery support (cds)|data and monitoring|related to|54286a988fb7490d9a86d8da96b43249||
covid-19 vaccine delivery support (cds)|supply chain systems|related to|54286a988fb7490d9a86d8da96b43249||
gavi|funding gaps for delivery|helped put in place|54286a988fb7490d9a86d8da96b43249||
gavi|countries' capacity to rapidly scale up covid-19 vaccinations|improve|54286a988fb7490d9a86d8da96b43249||
programme|health system strengthening|including|54286a988fb7490d9a86d8da96b43249||
cds investment|digitisation of health systems|saw the|54286a988fb7490d9a86d8da96b43249||
cds investment|strengthening of country's cold chain capacity|saw the|54286a988fb7490d9a86d8da96b43249||
cds investment|training of health workers|strengthened|54286a988fb7490d9a86d8da96b43249||
covax|routine immunisation|supported by|89bc1967110149bbbeeab91bd2716113||
primary covid-19 vaccine coverage|increased|from 5 percent to 41 percent|89bc1967110149bbbeeab91bd2716113||
gavi|invested approximately us$1.3 billion|in health systems in Gavi-implementing countries from 2021 to 2022|89bc1967110149bbbeeab91bd2716113||
regulatory readiness, harmonisation, and policy development|for pandemic preparedness|must be ensured in every country|89bc1967110149bbbeeab91bd2716113||
pandemic architecture|access for the most vulnerable people|should be built|89bc1967110149bbbeeab91bd2716113||
disparities in countries’ readiness levels, infrastructure, and capacity|in event of another pandemic|there will be|89bc1967110149bbbeeab91bd2716113||
global community|challenge of closing those gaps|cannot shirk from|89bc1967110149bbbeeab91bd2716113||
vaccine nationalism, hoarding, and export bans|lower barriers to the equitable supply of vaccines|must be avoided|89bc1967110149bbbeeab91bd2716113||
covax facility|emerged from a desire to prevent|a replay of what took place in 2009 during the H1N1 pandemic|89bc1967110149bbbeeab91bd2716113||
lower-income economies and wealthier nations|covax sought to pool demand for covid-19 vaccines|from|89bc1967110149bbbeeab91bd2716113||
covax|lower-income economies|seeks pooled demand from|81a04b1247ef4f6586112345ee3284c6||
covax|wealthier nations|seeks pooled demand from|81a04b1247ef4f6586112345ee3284c6||
covax|large-scale investments|can make with pooled demand and funding|81a04b1247ef4f6586112345ee3284c6||
covax|11 vaccine-candidates|across four technology platforms|81a04b1247ef4f6586112345ee3284c6||
covax|regulatory approval for use|of 10 of the 11 candidates|81a04b1247ef4f6586112345ee3284c6||
covax|4 billion doses|made available to 191 countries|81a04b1247ef4f6586112345ee3284c6||
h1n1 vaccine|dose domination pattern|COVAX would not follow this pattern|81a04b1247ef4f6586112345ee3284c6||
african continent|vaccine manufacturing capacity|lacks adequate vaccine manufacturing capacity|b6c2a98b763a48c2aae8cda39b29ffaa||
covid-19|pandemics in general|experience during COVID-19|b6c2a98b763a48c2aae8cda39b29ffaa||
vaccine manufacturing|regional production|must be established to promote diversified manufacturing base|b6c2a98b763a48c2aae8cda39b29ffaa||
technology transfer|demand-side financing|support for technology transfer and demand-side financing|b6c2a98b763a48c2aae8cda39b29ffaa||
gavi|african union commission|entered a Memorandum of Understanding|b6c2a98b763a48c2aae8cda39b29ffaa||
memorandum of understanding|may 2023|signed in May 2023|b6c2a98b763a48c2aae8cda39b29ffaa||
immunisation programmes|commitments|increase political, financial, and technical investments|b6c2a98b763a48c2aae8cda39b29ffaa||
lower-income countries|high-income countries|receive volumes of vaccine doses at the same time and in the same levels|b6c2a98b763a48c2aae8cda39b29ffaa||
pandemic|vaccine doses|occurrence|3692203dde53471fb79f6b9dd7bf58aa||
lower-income countries|high-income countries|comparison|3692203dde53471fb79f6b9dd7bf58aa||
manufacturers' transparency|supply inequities|relation|3692203dde53471fb79f6b9dd7bf58aa||
contingent financing|unexpected trends|availability|3692203dde53471fb79f6b9dd7bf58aa||
covax amc funding|pvp funding|discussions|3692203dde53471fb79f6b9dd7bf58aa||
variant-containing vaccine boosters|country requirements|provision|3692203dde53471fb79f6b9dd7bf58aa||
2024–25 covid-19 programme|gavi board approval||3692203dde53471fb79f6b9dd7bf58aa||approval
funds for other health emergencies|pandemic effects|utilization|3692203dde53471fb79f6b9dd7bf58aa||
accelerating diversified manufacturing|december board meeting||3692203dde53471fb79f6b9dd7bf58aa||discussion
global health crisis|biggest and most devastating global health crisis in more than a century|is|347f88a5870b41f185abcb1de7d74b12||
global community|moved past the worst of the biggest and most devastating global health crisis in more than a century|has overcome|347f88a5870b41f185abcb1de7d74b12||
sense of relief|three years of searing crisis|came from|347f88a5870b41f185abcb1de7d74b12||
understandable weariness|three years of searing crisis|caused by|347f88a5870b41f185abcb1de7d74b12||
complacency or neglect|sense of relief and understandable weariness|may lead to|347f88a5870b41f185abcb1de7d74b12||
the future|learning from what the world lived through|depends on|347f88a5870b41f185abcb1de7d74b12||
big, smart changes|future depends on learning and making|are required by|347f88a5870b41f185abcb1de7d74b12||
aurélia nguyen|chief programme strategy officer at gavi, the vaccine alliance|is|347f88a5870b41f185abcb1de7d74b12||
gavi, the vaccine alliance|aurélia nguyen is chief programme strategy officer|has as its chief programme strategy officer|347f88a5870b41f185abcb1de7d74b12||
office of the covax facility|served as managing director for first two and a half years of pandemic|works at|347f88a5870b41f185abcb1de7d74b12||
gavi’s managing director|previously held position, vaccines and sustainability|was in|347f88a5870b41f185abcb1de7d74b12||
covid-19 pandemic|epidemic and pandemic preparedness measures|caused deficiency|abf14dd14f25491dbf10495484afc8aa||
world|countries and regions|geographic area|abf14dd14f25491dbf10495484afc8aa||
covid-19 pandemic|sars-cov-2 coronavirus|caused by|abf14dd14f25491dbf10495484afc8aa||
years of studying other similar viruses|scientists had the chance to develop and hone techniques|enabling development|abf14dd14f25491dbf10495484afc8aa||
respiratory syncytial virus (rsv)|research initially|study subject|abf14dd14f25491dbf10495484afc8aa||
sars coronavirus|subsequently on|study subject|abf14dd14f25491dbf10495484afc8aa||
mers coronavirus|first reported|study subject|abf14dd14f25491dbf10495484afc8aa||
global vaccine library|saudi arabia|Location|eac4fb2d0ec3485093755074f08e0cb4||
scientists|decades of work|Accomplishment|eac4fb2d0ec3485093755074f08e0cb4||
spikes protein|coronavirus|Component|eac4fb2d0ec3485093755074f08e0cb4||
neutralising antibodies|effective vaccines|Goal|eac4fb2d0ec3485093755074f08e0cb4||
sars-cov-2|novel coronavirus|Type|eac4fb2d0ec3485093755074f08e0cb4||
drug developers|pulled off the shelf|Technique|eac4fb2d0ec3485093755074f08e0cb4||
rsv, sars and mers virology|tweaked|Usage|eac4fb2d0ec3485093755074f08e0cb4||
humanity|not reinventing the wheel|Approach|eac4fb2d0ec3485093755074f08e0cb4||
covid-19|virus causing|Effect|eac4fb2d0ec3485093755074f08e0cb4||
mpox|formerly known as monkeypox|Renaming|eac4fb2d0ec3485093755074f08e0cb4||
orthopoxviruses|viral family|Membership|eac4fb2d0ec3485093755074f08e0cb4||
mpox outbreak|geographies reached|Scope|eac4fb2d0ec3485093755074f08e0cb4||
smallpox|eradicated human disease|was|ac169d2f7ba94e499cac064424d51111||
smallpox vaccines|provided broad protection|against|ac169d2f7ba94e499cac064424d51111||
mpox|part of orthopoxvirus family|is a|ac169d2f7ba94e499cac064424d51111||
smallpox vaccines|offer protection against mpox|provide|ac169d2f7ba94e499cac064424d51111||
national and international health security bodies|maintained stockpiles of smallpox vaccines|decided to|ac169d2f7ba94e499cac064424d51111||
accelerating global health|pathways to health equity for the g20|Topic|45c5d935196b4e8ab17e7b96fcbf2818||
viral threat|humanity|Subject|45c5d935196b4e8ab17e7b96fcbf2818||
infectious pathogen|viral threat|Relation|45c5d935196b4e8ab17e7b96fcbf2818||
containment race|serious epidemic|Against|45c5d935196b4e8ab17e7b96fcbf2818||
emerging virus|pandemic threat|Cause|45c5d935196b4e8ab17e7b96fcbf2818||
one world vaccine library|concept|By CEPI|45c5d935196b4e8ab17e7b96fcbf2818||
global community|achieve greater health security|Objective|45c5d935196b4e8ab17e7b96fcbf2818||
pandemic threat|human disease outbreaks|From|45c5d935196b4e8ab17e7b96fcbf2818||
viral families|viral threat|Known to Cause|45c5d935196b4e8ab17e7b96fcbf2818||
one world vaccine library|whole world|For the|45c5d935196b4e8ab17e7b96fcbf2818||
vaccines|potent tools against pandemic threats|Role|45c5d935196b4e8ab17e7b96fcbf2818||
deployed vaccine|mitigate and contain outbreaks|Action|45c5d935196b4e8ab17e7b96fcbf2818||
one world vaccine library|scientists|can help to prepare|d44f7d2a0db640ff9c3ff89ee5b3668c||
viral-family-based prototype vaccine approach|world's defences against them|is used for creating|d44f7d2a0db640ff9c3ff89ee5b3668c||
scientists|new vaccines|cannot create new|d44f7d2a0db640ff9c3ff89ee5b3668c||
viral threats|known or unknown|pose a threat to people|d44f7d2a0db640ff9c3ff89ee5b3668c||
world's scientists|new vaccines against every one of them|just on a chance that they might|d44f7d2a0db640ff9c3ff89ee5b3668c||
paramyxoviruses|pandemic threat|threatens|b0476594560848e5a8e36df2397bc0ea||
paramyxovirus family|measles|included in|b0476594560848e5a8e36df2397bc0ea||
paramyxovirus family|mumps|included in|b0476594560848e5a8e36df2397bc0ea||
paramyxovirus family|hendra|included in|b0476594560848e5a8e36df2397bc0ea||
paramyxovirus family|nipah|included in|b0476594560848e5a8e36df2397bc0ea||
one world vaccine library|paramyxovirus section|has|b0476594560848e5a8e36df2397bc0ea||
one world vaccine library's paramyxovirus section|research, data and technical knowledge|stocked with|b0476594560848e5a8e36df2397bc0ea||
library|scientific knowledge|collate|b0476594560848e5a8e36df2397bc0ea||
library|prototype rapid-response vaccine candidates|generate|b0476594560848e5a8e36df2397bc0ea||
one world vaccine library|investment|requires|752aaba01d014b229677ddfa9be7e095||
one world vaccine library|knowledge|accesses|752aaba01d014b229677ddfa9be7e095||
one world vaccine library|viral pandemics|protects against|752aaba01d014b229677ddfa9be7e095||
one world vaccine library|sequence genome|enables|752aaba01d014b229677ddfa9be7e095||
one world vaccine library|prototype vaccines|selects|752aaba01d014b229677ddfa9be7e095||
one world vaccine library|epidemic or pandemic threat|addresses|752aaba01d014b229677ddfa9be7e095||
one world vaccine library|cepi|development and stocking|2b40e9b8f0d24ea9bf8b24f342c9a7d1||
disease x|global health security|greatest threat|2b40e9b8f0d24ea9bf8b24f342c9a7d1||
virus families|vaccine candidates|potential to spawn|2b40e9b8f0d24ea9bf8b24f342c9a7d1||
cepi|virus experts|ranking and assessment|2b40e9b8f0d24ea9bf8b24f342c9a7d1||
preclinical testing|vaccines in library|create vaccine candidates|2b40e9b8f0d24ea9bf8b24f342c9a7d1||
cepi|next five years|establish clinical proof of concept|2b40e9b8f0d24ea9bf8b24f342c9a7d1||
100 days mission|g7 and g20|embraced by|866dcc7ae951407e81247418bfc9ded3||
one world vaccine library|cepi's 100 days mission|critical enabler of|866dcc7ae951407e81247418bfc9ded3||
swift and effective use|non-pharmaceutical interventions|such as|866dcc7ae951407e81247418bfc9ded3||
disease x pandemic virus|existential threat|posed by|866dcc7ae951407e81247418bfc9ded3||
viral races|emerging disease threats|from|866dcc7ae951407e81247418bfc9ded3||
one world vaccine library|comprehensive and extensive|being|866dcc7ae951407e81247418bfc9ded3||
one world vaccine library|immediate accessibility|to all nations and regions|866dcc7ae951407e81247418bfc9ded3||
bank of knowledge|one world vaccine library|builds up in|866dcc7ae951407e81247418bfc9ded3||
library|viral infectious diseases|helps people against|a6893ff6377a470b8c4d24061e062736||
library|world’s best scientific minds, political leaders and health security experts|combined resources from|a6893ff6377a470b8c4d24061e062736||
library|future free from the deadly threat of pandemics|prospect for future|a6893ff6377a470b8c4d24061e062736||
dr. richard hatchett|cepi|Chief Executive Officer of|a6893ff6377a470b8c4d24061e062736||
kate kelland|cepi|Chief Scientific Writer for|a6893ff6377a470b8c4d24061e062736||
public health system|public health workers|backbone|11488b72ecf34335b62473afa88f1450||
covid-19 pandemic|core public health capacities|tested and exposed the weaknesses in|11488b72ecf34335b62473afa88f1450||
weaknesses in core public health capacities|underfunding and lack of political commitment to public health|result of|11488b72ecf34335b62473afa88f1450||
mortality and morbidity due to severe disruptions in essential health services|increased from covid-19|cause|11488b72ecf34335b62473afa88f1450||
health systems|disease outbreaks|not prepared for|11488b72ecf34335b62473afa88f1450||
shortages in the health workforce|limited availability|critical bottleneck|11488b72ecf34335b62473afa88f1450||
health workers|infections and deaths from covid-19|caused by|11488b72ecf34335b62473afa88f1450||
health workers|mental health issues, including burnout|result from|11488b72ecf34335b62473afa88f1450||
poor working conditions|burden on health workers|caused by|11488b72ecf34335b62473afa88f1450||
public health emergencies|protracted conflicts|include|b82e440ece464069a77bf88f9e5ada99||
public health emergencies|global increase in climate-related and humanitarian disasters|contribute to|b82e440ece464069a77bf88f9e5ada99||
public health crisis|reversals in life expectancy|cause|b82e440ece464069a77bf88f9e5ada99||
public health crisis|sustainable development goals|affect|b82e440ece464069a77bf88f9e5ada99||
investing in the public health workforce|strengthening national health systems|investment in 12 Essential Public Health Functions|62d9f40cfb654006a0859c0ef5ed39ee||
