node_1|node_2|edge|chunk_id|node_ 1|Edge
essential public health functions (ephf)|all-hazards emergency risk management approach|delivered through national public health workforce capacity|62d9f40cfb654006a0859c0ef5ed39ee||
national public health workforce capacity|political leadership and global investment|essential for delivering EPHFs|62d9f40cfb654006a0859c0ef5ed39ee||
global consensus to strengthen public health|g7 and g20 intergovernmental processes|consensus within from 2021 to 2023|62d9f40cfb654006a0859c0ef5ed39ee||
world health organization (who)|global partnership of associations, institutions, and schools of public health|coordinated to develop a WHO Roadmap for strengthening national public health workforces|62d9f40cfb654006a0859c0ef5ed39ee||
g20’s and g7’s role|incorporating public health within their intergovernmental deliberations|aiming to address global health challenges and foster international cooperation|62d9f40cfb654006a0859c0ef5ed39ee||
reinforced during the pandemic|political and technical consensus within g7 and g20 intergovernmental processes from 2021 to 2023.|Contributed to an iterative process coordinated by WHO|62d9f40cfb654006a0859c0ef5ed39ee||
global health challenges|international cooperation|address|1be624b611cc491db7d1687100ae5d34||
covid-19 pandemic|g20 and g7 platforms|reinforced during|1be624b611cc491db7d1687100ae5d34||
ephfs|health sector|within and beyond|1be624b611cc491db7d1687100ae5d34||
effective public health action|prevent disease and promote health and well-being|ensure|1be624b611cc491db7d1687100ae5d34||
world federation of public health associations (wfpha)|international association of national public health institutions (ianphi) and global network academic schools of public health (gnasph)|including|1be624b611cc491db7d1687100ae5d34||
g20|g7|Organizations holding meetings and signing declarations|17c2b5995f3d4131bd1c7f8cd1aea347||
global health summit|rome declaration|Event held by G20, leading to a political declaration|17c2b5995f3d4131bd1c7f8cd1aea347||
g20 italia declaration of health ministers|global consensus|Resulting from the Rome Declaration and focusing on investment in health systems|17c2b5995f3d4131bd1c7f8cd1aea347||
rome declaration|political consensus|Strengthening the health workforce by recognizing its sacrifices|17c2b5995f3d4131bd1c7f8cd1aea347||
health workforce|protection and investment|Education, employment, and retention to strengthen multidisciplinary teams|17c2b5995f3d4131bd1c7f8cd1aea347||
carbis bay health declaration|g7 summit 2021|Signing the declaration in June 2021, United Kingdom|17c2b5995f3d4131bd1c7f8cd1aea347||
g7 summit|cornwall, united kingdom|location|680110c39c674b5695eef6dc5c29a063||
g7 summit 2021|covid-19|primary objective|680110c39c674b5695eef6dc5c29a063||
health and care workers|g7 summit|recognised contributions|680110c39c674b5695eef6dc5c29a063||
g7 germany 2022|germany's presidency of the g7|built upon|680110c39c674b5695eef6dc5c29a063||
g7 pact for pandemic readiness|g7 ministers|launched by|680110c39c674b5695eef6dc5c29a063||
surveillance in low- and lower-middle income countries (lmics)|strengthening collaborative surveillance|focuses on|680110c39c674b5695eef6dc5c29a063||
investing in the public health workforce|predictable rapid regional and global surge readiness groups|alignment|5ffa8a052fda4a48832954cb28fccad6||
pandemic preparedness and response|who member states in strengthening the global architecture for health emergency preparedness and response (hepr)|demonstrated alignment|5ffa8a052fda4a48832954cb28fccad6||
global health architecture around health emergency governance, systems, and financing|principles of ephfs at a global level|applies|5ffa8a052fda4a48832954cb28fccad6||
g7’s roadmap for practical cooperation to advance the g7 pact|help 100 countries strengthen their international health regulation (ihr 2005) core capacities|committed|5ffa8a052fda4a48832954cb28fccad6||
g20 in indonesia|launching the pandemic fund|advance global health architecture for emergency preparedness and response|5ffa8a052fda4a48832954cb28fccad6||
pandemic fund|strengthen countries’ pandemic prevention, preparedness, and response (ppr) capacities|aims to|5ffa8a052fda4a48832954cb28fccad6||
pandemic fund|catalyse investment in critical health workforce capacities and health systems|strengthens synergies|5ffa8a052fda4a48832954cb28fccad6||
core domains of the ihr 2005 and the world organisation for animal health’s (woah) international standards|pandemic fund|aims to cover|5ffa8a052fda4a48832954cb28fccad6||
health's (woah) international standards|us$10 billion per year of international funding|need for catalytic funding|87486127dc55458db953d30ad3b03b4d||
hepr|intergovernmental negotiating body on new who convention, agreement, or other international instrument on ppr (who ca+)|contains|87486127dc55458db953d30ad3b03b4d||
hepr|international health regulation amendments|contains|87486127dc55458db953d30ad3b03b4d||
ihr 2005|core capacities for surveillance and responses|require public health capacities|87486127dc55458db953d30ad3b03b4d||
joint external evaluation tool|ihr 2005 capacities assessment|used for|87486127dc55458db953d30ad3b03b4d||
national multisectoral skilled and competent health personnel|sustainable and functional public health surveillance and response at all levels of the health system|required by countries with the highest scores for IHR capacities|87486127dc55458db953d30ad3b03b4d||
pandemic fund|annual amount needed|pledges from donors and foreign aid|87486127dc55458db953d30ad3b03b4d||
g7|japan, 2023|location|529770bb53184afba32ffa3ad3fa81f1||
health consensus|national public health and emergency workforce|goal|529770bb53184afba32ffa3ad3fa81f1||
uhc action agenda|action area 8|part of|529770bb53184afba32ffa3ad3fa81f1||
ephfs|who roadmap|reference|529770bb53184afba32ffa3ad3fa81f1||
g7 leaders|global network of experts|support|529770bb53184afba32ffa3ad3fa81f1||
ihr core capacities|100 lmics until 2027|commitment|529770bb53184afba32ffa3ad3fa81f1||
impact investment initiative for global health|united nations’ three high-level meetings|initiative|529770bb53184afba32ffa3ad3fa81f1||
essential health services|pre-pandemic level|goal|529770bb53184afba32ffa3ad3fa81f1||
global partners|developed reference documents and tools|for countries|d0f37eee53de40eb86a850883db49084||
national stakeholders|assess their public health workforce|against the standard EPHF|d0f37eee53de40eb86a850883db49084||
whole-of-government and whole-of-society approach|involves national stakeholders|existing networks of partners|d0f37eee53de40eb86a850883db49084||
country-based assessment|guide policy improvement|address gaps in workforce planning, delivery, and competency-based education curricula|d0f37eee53de40eb86a850883db49084||
world bank's pandemic fund|launched in november 2022|Strengthening human resources|d0f37eee53de40eb86a850883db49084||
resources to help countries|health emergencies|prevent, prepare for|5b43a574fd4f40b5a10d4d9081c9448a||
resources to help countries|lmics|priority|5b43a574fd4f40b5a10d4d9081c9448a||
sustainable public health workforce capacity|lmics|in LMICs|5b43a574fd4f40b5a10d4d9081c9448a||
roadmap|ihr 2005 amendments|alignment with|5b43a574fd4f40b5a10d4d9081c9448a||
roadmap|global pandemic accord|assists in|5b43a574fd4f40b5a10d4d9081c9448a||
roadmap|intergovernmental negotiating body (inb)|new WHO convention, agreement, or other international instruments on PPR (WHO CA+)|5b43a574fd4f40b5a10d4d9081c9448a||
hepr|intergovernmental negotiating body|ongoing part|5b43a574fd4f40b5a10d4d9081c9448a||
intergovernmental consensus and commitment for public health strengthening|public health workforce needs|Addressing|1674d91ad4154cee9c2bfc7bbc26a5cd||
g20 in india|development cooperation for sdgs and global health architecture for ppr|Important priorities|1674d91ad4154cee9c2bfc7bbc26a5cd||
india|public health workforce strengthening from the perspective of developing countries|Signalled|1674d91ad4154cee9c2bfc7bbc26a5cd||
lmics|multilateral investment|Leveraged to strengthen public health workforce|1674d91ad4154cee9c2bfc7bbc26a5cd||
g20 stakeholders and partners|expand domestic financing to strengthen national health system capacity|Role in|1674d91ad4154cee9c2bfc7bbc26a5cd||
lmics|national public health and health system strengthening|Support|1674d91ad4154cee9c2bfc7bbc26a5cd||
health and health system strengthening|g7 commitment|committed by|7a6b19e8970147368367270706392a50||
impact investment initiative for global health|capitalise and leverage|for|7a6b19e8970147368367270706392a50||
pandemic fund|meet demand|to|7a6b19e8970147368367270706392a50||
g20 consensus language on protecting and investing in the public health workforce|consistent with italy g20 language and recommendations from the 5th global forum on human resources for health|strengthen and position|7a6b19e8970147368367270706392a50||
un hlm for ppr in new york|preparations and outcomes|for the|7a6b19e8970147368367270706392a50||
member state deliberations on ihr amendments and who ca+ in geneva|g20 consensus language|in|7a6b19e8970147368367270706392a50||
strengthen and position gender inequality|contribute to an enabling environment for women’s economic and social rights|relationship|2ab4e315dc444a4ea4484a0a2bcaccdb||
gender-equitable policy for the health sector|contribute to an enabling environment for women’s economic and social rights|relationship|2ab4e315dc444a4ea4484a0a2bcaccdb||
wenzhen (jen) zuo|world health organization|affiliation|2ab4e315dc444a4ea4484a0a2bcaccdb||
huan xu|health workforce department, world health organization|affiliation|2ab4e315dc444a4ea4484a0a2bcaccdb||
lizzie tecson|health workforce department, world health organization|affiliation|2ab4e315dc444a4ea4484a0a2bcaccdb||
bettina borisch|university of geneva and world federation of public health associations(wfpha)|affiliation|2ab4e315dc444a4ea4484a0a2bcaccdb||
sadaf lynes|international association of national public health institutes (ianphi)|affiliation|2ab4e315dc444a4ea4484a0a2bcaccdb||
laura magaña|association of schools and programs of public health (aspph)|affiliation|2ab4e315dc444a4ea4484a0a2bcaccdb||
priscilla robinson|latrobe university|affiliation|2ab4e315dc444a4ea4484a0a2bcaccdb||
duncan selbie|international association of national public health institutes (ianphi)|affiliation|2ab4e315dc444a4ea4484a0a2bcaccdb||
duncan selbie|international association of national public health institutes|is a President|5fa3147f3d21436e88b0f3e51e257757||
jim campbell|world health organization|works as a Director, Health Workforce Department|5fa3147f3d21436e88b0f3e51e257757||
one health|interconnected factors|consideration|8cb396872001467fa610927f2b7ca3b1||
one health|disease prevention and control|focus|8cb396872001467fa610927f2b7ca3b1||
one health|transdisciplinary approach|methodology|8cb396872001467fa610927f2b7ca3b1||
one health|multisectoral collaboration|facilitates|8cb396872001467fa610927f2b7ca3b1||
one health|antimicrobial resistance|addresses|8cb396872001467fa610927f2b7ca3b1||
one health|zoonoses and vector- food- water-borne diseases|prevention and control|8cb396872001467fa610927f2b7ca3b1||
world health organization, food and agriculture organization, united nations environment programme, world organisation for animal health|quadripartite collaboration|responsible for OH operations|8cb396872001467fa610927f2b7ca3b1||
one health|guiding countries in planning and adapting strategies|purpose|8cb396872001467fa610927f2b7ca3b1||
implementing one health|enhancing pandemic prevention, preparedness, and response|achievement|8cb396872001467fa610927f2b7ca3b1||
implementing one health|strengthening domestic health systems|result|8cb396872001467fa610927f2b7ca3b1||
one health|world health organization (who)|Defines|f907599a09644db7ae6534847f11b19a||
one health|integrated, unifying approach|Aims to|f907599a09644db7ae6534847f11b19a||
one health|people, animals, and ecosystems|Balances and optimizes the health of|f907599a09644db7ae6534847f11b19a||
one health|social, economic and physical environments|Important determinants of health|f907599a09644db7ae6534847f11b19a||
one health|individual's characteristics and behavioural patterns|Influences|f907599a09644db7ae6534847f11b19a||
one health|animal trade, agriculture, livestock farming, urbanisation, extractive industries, climate change, habitat fragmentation, encroachment into wild areas|Impact on human health|f907599a09644db7ae6534847f11b19a||
one health|possible interactions of these factors with an individual's health|Consideration for optimal health outcomes|f907599a09644db7ae6534847f11b19a||
one health|health intervention|Design and implementation|f907599a09644db7ae6534847f11b19a||
one health|multisectoral inclusivity|In addressing health-related issues|f907599a09644db7ae6534847f11b19a||
antimicrobial resistance (amr)|medical intervention|Requires|f907599a09644db7ae6534847f11b19a||
antimicrobial resistance (amr)|checking antibacterial content in food and water|Addressing|f907599a09644db7ae6534847f11b19a||
one health|collaborative, multisectoral, transdisciplinary approach|Encourages|f907599a09644db7ae6534847f11b19a||
one health|local, regional, national, and global levels|Applies at|f907599a09644db7ae6534847f11b19a||
one health|people, animals, plants, and their interconnection|Recognises|f907599a09644db7ae6534847f11b19a||
oh concept|policy, advocacy, financing, organisational development, data, evidence, and knowledge|focused on providing sustainable and long-lasting results at all levels|dcccb60ee13a48b49d3e99676789581c||
oh concept|priority health issues|world’s urgent attention|dcccb60ee13a48b49d3e99676789581c||
antimicrobial resistance (amr)|human health, food security, and development|one of the greatest threats to|dcccb60ee13a48b49d3e99676789581c||
who|amr as one of the top 10 global public health threats|declared|dcccb60ee13a48b49d3e99676789581c||
amr|nearly 10 million deaths by 2050, global economy cost between us$11–444 million|by 2050|dcccb60ee13a48b49d3e99676789581c||
amr|increased drug exposure|causes|dbd06533e0f8426bb5c48add38e4a7af||
amr|misuse or overuse of antimicrobials|cause|dbd06533e0f8426bb5c48add38e4a7af||
amr|multiplication of pathogens due to unhygienic water and poor sanitation processes|cause|dbd06533e0f8426bb5c48add38e4a7af||
amr|inadequate infection prevention and control measures in hospitals and healthcare settings|cause|dbd06533e0f8426bb5c48add38e4a7af||
amr|use of antibiotics in the farming, livestock, and fisheries sectors|cause|dbd06533e0f8426bb5c48add38e4a7af||
amr|close contact with animals and contamination of soil and water with these microbes|cause|dbd06533e0f8426bb5c48add38e4a7af||
amr|exposure to drug-resistant tuberculosis, hiv infections, and specific amrs such as artemisinin-based combination therapy-resistance in malaria treatment, and antileprotic drug resistance|causes|dbd06533e0f8426bb5c48add38e4a7af||
amr|managing serious infections in children and adults alongside any surgical intervention|challenge|dbd06533e0f8426bb5c48add38e4a7af||
amr|global health system is already exposed to drug-resistant diseases|exposed|dbd06533e0f8426bb5c48add38e4a7af||
amr|zoonotic diseases and 75 percent of them originating from animals|cause|dbd06533e0f8426bb5c48add38e4a7af||
urbanisation|destruction of natural habitats of animals|leads to increase interaction between animals, animal products and humans|2f884a037acc49378eeae7a7fb414b1e||
urbanisation|illegal trade in wildlife|contributes to zoonotic spillover|2f884a037acc49378eeae7a7fb414b1e||
urbanisation|wet markets|increases the risk of zoonotic disease|2f884a037acc49378eeae7a7fb414b1e||
zoonotic infections|humans|established in humans|2f884a037acc49378eeae7a7fb414b1e||
urbanisation|food-borne zoonotic diseases|can be prevented through proper handling of meat, eggs, dairy, and vegetables|2f884a037acc49378eeae7a7fb414b1e||
one health|zoonotic infectious diseases|approach|cde4a7c94f2f4ca8bd465e9272856a9b||
awareness|prevention and risk reduction strategies|strategies|cde4a7c94f2f4ca8bd465e9272856a9b||
investing|interdisciplinary approaches|including OH perspectives|cde4a7c94f2f4ca8bd465e9272856a9b||
research|complex social, economic, and ecological dimensions of diseases|to explore|cde4a7c94f2f4ca8bd465e9272856a9b||
monitoring|food systems|from farm to fork|cde4a7c94f2f4ca8bd465e9272856a9b||
biosecurity and zoonoses-control measures|industrial and disadvantaged smallholder farmers and herders|for both|cde4a7c94f2f4ca8bd465e9272856a9b||
supporting|agricultural and wildlife habitats|by managing landscapes and seascapes collectively|cde4a7c94f2f4ca8bd465e9272856a9b||
promoting|agro-ecological methods of food production|mitigating waste and pollution|cde4a7c94f2f4ca8bd465e9272856a9b||
biodiversity|government and private-sector planning, decision-making, and capacity building|during|cde4a7c94f2f4ca8bd465e9272856a9b||
global early warning and response system for major animal diseases|combating zoonoses to coordinate risk assessment and assist in early warning, prevention, and control of disease threats|established by WHO, FAO, and WOAH|cde4a7c94f2f4ca8bd465e9272856a9b||
vector-borne diseases|diseases||cde4a7c94f2f4ca8bd465e9272856a9b||
combat zoonoses|coordinate risk assessment|to assist in|ff8f20fb0aac4191b052993d77f15999||
combat zoonoses|early warning, prevention, and control of disease threats|to coordinate|ff8f20fb0aac4191b052993d77f15999||
vector-borne diseases|determining demographic factors|related to|ff8f20fb0aac4191b052993d77f15999||
vector-borne diseases|environmental factors|related to|ff8f20fb0aac4191b052993d77f15999||
vector-borne diseases|social factors|related to|ff8f20fb0aac4191b052993d77f15999||
distribution of vector-borne diseases|global travel|affected by|ff8f20fb0aac4191b052993d77f15999||
distribution of vector-borne diseases|trade|affected by|ff8f20fb0aac4191b052993d77f15999||
distribution of vector-borne diseases|unplanned urbanisation|affected by|ff8f20fb0aac4191b052993d77f15999||
who's global vector control response (gvcr) 2017–2030|strengthening vector-control programmes|provides strategic guidance to countries for|ff8f20fb0aac4191b052993d77f15999||
water-borne diseases|contaminated water|cause|c28f27b2026346d8b1c25d3ac4fb35f1||
water-borne diseases|faecal-contaminated water|consumed by|c28f27b2026346d8b1c25d3ac4fb35f1||
faecal-contaminated water|global population|affecting|c28f27b2026346d8b1c25d3ac4fb35f1||
water-borne diseases|cholera, dysentery, typhoid, polio|caused by|c28f27b2026346d8b1c25d3ac4fb35f1||
water-borne diseases|around 485,000 deaths annually|resulting in|c28f27b2026346d8b1c25d3ac4fb35f1||
food-borne diseases|over 200 diseases|caused by|c28f27b2026346d8b1c25d3ac4fb35f1||
food-borne diseases|contaminated food|consumption of|c28f27b2026346d8b1c25d3ac4fb35f1||
globally, 600 million people are affected|420,000 deaths annually|caused by|c28f27b2026346d8b1c25d3ac4fb35f1||
safe and nutritious food|promoting good health|key to sustaining|c28f27b2026346d8b1c25d3ac4fb35f1||
one health|who, fao, unep, woah|signed a memorandum of understanding|c28f27b2026346d8b1c25d3ac4fb35f1||
one health|quadripartite collaboration for one health|forming the|c28f27b2026346d8b1c25d3ac4fb35f1||
quadripartite collaboration for one health|who, fao, unep, woah|consists of|c28f27b2026346d8b1c25d3ac4fb35f1||
one health|animal and public health risks|aiming to prevent, detect, contain, eliminate and respond to|c28f27b2026346d8b1c25d3ac4fb35f1||
food security|multi-sectoral cooperation|through|3eb3f6d6d48542a68f240d92f26cae0b||
one health high-level expert panel|quadripartite|advisory group to the|3eb3f6d6d48542a68f240d92f26cae0b||
first one health joint plan of action (2022-2026)|combat health risks|at the human–animal–environment interface|3eb3f6d6d48542a68f240d92f26cae0b||
quadripartite|all countries|urged to translate the OH approach|3eb3f6d6d48542a68f240d92f26cae0b||
oh approach|policy actions|by promoting and increasing investment in intersectoral health governance|3eb3f6d6d48542a68f240d92f26cae0b||
countries|national oh policies|adopt|3eb3f6d6d48542a68f240d92f26cae0b||
research institutions|improved genomic surveillance and data-sharing practices|encouraged to work on|3eb3f6d6d48542a68f240d92f26cae0b||
academic courses on oh|workforce|train and equip|3eb3f6d6d48542a68f240d92f26cae0b||
one health|pandemic prevention and preparedness|similar approach|acb5a4d42cd747a5bb0bf5035f6a2d56||
world bank fund for pandemic prevention|one health approach|Utilized for operationalising|acb5a4d42cd747a5bb0bf5035f6a2d56||
un high-level meeting on pandemic|one health agenda integration|during planning session|acb5a4d42cd747a5bb0bf5035f6a2d56||
world bank's required amount for oh implementation|annual global allocation|Needed for implementation|acb5a4d42cd747a5bb0bf5035f6a2d56||
lack of centralized oh funding|relevant ministries responsibilities|Affecting strategy development|acb5a4d42cd747a5bb0bf5035f6a2d56||
world health organization|existing gaps in one health approach implementation|Identified by|acb5a4d42cd747a5bb0bf5035f6a2d56||
databases and knowledge-sharing resources|effective information exchange|Affected by|acb5a4d42cd747a5bb0bf5035f6a2d56||
best practice examples|encouraging one health initiatives|Shown to promote|acb5a4d42cd747a5bb0bf5035f6a2d56||
oh workforce mapping and generation|strengthening capacity|Involves|acb5a4d42cd747a5bb0bf5035f6a2d56||
integrated one health surveillance system development|establishing routine and emergency coordination mechanisms|Related to|acb5a4d42cd747a5bb0bf5035f6a2d56||
stakeholder communication|standardized framework for addressing zoonotic spillover|Involves|acb5a4d42cd747a5bb0bf5035f6a2d56||
stakeholders|standardised framework|creating|54b6a818f27a4747bc848ce2b3fca069||
standardised framework|zoonotic spillover risks|addressing|54b6a818f27a4747bc848ce2b3fca069||
zoonotic spillover risks|animal trade, agriculture, livestock farming|related to|54b6a818f27a4747bc848ce2b3fca069||
standardised framework|urbanisation and habitat fragmentation|addressing|54b6a818f27a4747bc848ce2b3fca069||
urbanisation and habitat fragmentation|spillover risks and disease spread|related to|54b6a818f27a4747bc848ce2b3fca069||
standardised framework|trade-offs, co-benefits|identifying spillover risks and disease spread|54b6a818f27a4747bc848ce2b3fca069||
g20 countries|improving global health|role|54b6a818f27a4747bc848ce2b3fca069||
g20 countries|world's largest economies|reason|54b6a818f27a4747bc848ce2b3fca069||
g20 countries|global population|home to|54b6a818f27a4747bc848ce2b3fca069||
g20 countries|non-communicable diseases|contribute to|11443940fbd24182af4b70641327ab56||
g20 countries|co2 emissions|account for|11443940fbd24182af4b70641327ab56||
india|one health approach|initiated under the office of Principal Scientific Adviser (PSA)|11443940fbd24182af4b70641327ab56||
one health approach|integrated disease control|aims to increase pandemic preparedness|11443940fbd24182af4b70641327ab56||
india|early warning system|established for endemic and emerging epidemic threats|11443940fbd24182af4b70641327ab56||
one health approach|integrated surveillance systems|aims to develop|11443940fbd24182af4b70641327ab56||
india|outbreak investigation mechanisms|implemented|11443940fbd24182af4b70641327ab56||
one health approach|r&d for critical tools|aims to develop|11443940fbd24182af4b70641327ab56||
india|data and database integration|aims for better information sharing|11443940fbd24182af4b70641327ab56||
one health|zoonotic diseases control and prevention|Approach|95e9919de1de4544bc48124bd30a8a42||
oh approach|zonotic disease control and prevention barriers|Operationalised|95e9919de1de4544bc48124bd30a8a42||
oh approach in india|contextual adaptation|Requires|95e9919de1de4544bc48124bd30a8a42||
existing interpersonal relationships|fostering informal collaborations|Focus|95e9919de1de4544bc48124bd30a8a42||
intersectoral coordination|veterinary workforce, academic institutions, local population|Requires|95e9919de1de4544bc48124bd30a8a42||
sars-cov2 vaccine trial|tamil nadu veterinary and animal sciences university|Collaboration|95e9919de1de4544bc48124bd30a8a42||
sars-cov2 vaccine trial|tamil nadu veterinary and animal sciences university|signed a pact with|ba6d12617e9d4d3da1a5a071f7087ae7||
tamil nadu dr mgr medical university|conducted joint academic and research activities|for conducting the SARS-CoV2 vaccine trial|ba6d12617e9d4d3da1a5a071f7087ae7||
outbreak investigation in punjab|community health workers|actively participated|ba6d12617e9d4d3da1a5a071f7087ae7||
non-government organisations|auxiliary nursing midwives, accredited social health activists (ashas) and village leaders|actively participated|ba6d12617e9d4d3da1a5a071f7087ae7||
pandemic prevention, preparedness, response|implementing the oh approach|will enhance|ba6d12617e9d4d3da1a5a071f7087ae7||
oh approach|strengthen systems and cross-sectoral capacities|allowing for co-design and implementation|ba6d12617e9d4d3da1a5a071f7087ae7||
inclusive and equitable multi-level workplans and strategies|oh principles|in line with|ba6d12617e9d4d3da1a5a071f7087ae7||
harmonised oh tools, technologies, and practices|develop, disseminate, and utilise improved|integrate data and knowledge|ba6d12617e9d4d3da1a5a071f7087ae7||
global health|pathways to health equity for the g20|Theme|763c7ccbb18c440fae959857c92fe260||
infectious diseases|better surveillance systems|Prevention method|763c7ccbb18c440fae959857c92fe260||
organisations|collaboration between organisations|Improvement method|763c7ccbb18c440fae959857c92fe260||
india's g20 theme|global collaboration and solidarity|Concept|763c7ccbb18c440fae959857c92fe260||
global collaboration and solidarity|live harmoniously with nature|Connection|763c7ccbb18c440fae959857c92fe260||
