node_1|node_2|edge|chunk_id
private health sector regulation|medical tourism hub|State-of-the-art corporate hospitals provide world class care and have made India one of the major hubs for medical tourism.|c9b13b685d7e48e28adbf2df53cc8450
health insurance scheme for central government employees|private health sector utilization|The health insurance scheme for central government employees in India purchases services from the private sector. This model can be expanded to scale for the population using the newly launched national health insurance scheme (Ayushman Bharat).|c9b13b685d7e48e28adbf2df53cc8450
digital technology|evin|In India, digital technology is being used to facilitate its vaccination program through the development of a digital track and trace system named eVin for tracking vaccine availability and facilitating cold chain maintenance as part of its national immunization program. This system is now enjoying widespread use to accelerate Covid-19 vaccination.|588de2e208414037b68041b1338b129e
digital technology|online training management information systems|Indigenously developed Online Training Management Information Systems help schedule training for new personnel, maintain records and dashboards facilitate monitoring, evaluation and policy formulation.|588de2e208414037b68041b1338b129e
medical devices|wearable, trackable technology|Medical devices, mobile health apps, and wearable, trackable technology have all enhanced opportunities for personalized care, self-management, behavior modification and tele-monitoring of patients.|588de2e208414037b68041b1338b129e
expanding application of technology to other portfolios within the health sector|innovations in digital technology supporting delivery of vital healthcare in high-income countries|Similarity in concept as both refer to increasing the use of technology to provide healthcare services, with High-Income Countries being seen as leading innovators in this area.|c59bae4e4e934065bf72403a2c34dce8
expanding application of technology to other portfolios within the health sector|covid-19 pandemic catalyzing process and enabling delivery of healthcare|Causal relationship as the pandemic has accelerated the adoption and usage of digital technologies in healthcare due to its impact on people's mobility and social distancing requirements.|c59bae4e4e934065bf72403a2c34dce8
telemedicine for consultations with healthcare providers|uptake of telemedicine during covid-19 pandemic|Temporal relationship as the use of telemedicine has increased significantly during the pandemic due to restrictions on physical meetings.|c59bae4e4e934065bf72403a2c34dce8
doctors can now perform an ophthalmic fundal examination online|remote orthopedic examinations being used successfully|Similarity in concept as both refer to remote medical consultations and examinations facilitated by digital technologies.|c59bae4e4e934065bf72403a2c34dce8
drones being used to deliver medicines to communities|manufacturing protective equipment locally using 3d printing|Similarity in concept as both refer to local production of medical supplies through digital technologies.|c59bae4e4e934065bf72403a2c34dce8
ai-embedded logarithms now diagnose covid-19 disease from chest x-rays and ct scans|innovations in digital technology supporting delivery of vital healthcare in high-income countries|Similarity in concept as both refer to the use of advanced technologies such as AI for healthcare delivery.|c59bae4e4e934065bf72403a2c34dce8
live register for health personnel and infrastructure|central government's leadership in the fight for better health for all indians|India needs to have a live register for health personnel and infrastructure, but this will only happen if the central government again asserts leadership in the fight for better health for all Indians, not just those with the money to pay unassisted.|8c7d4038a578437e8b1ddf7cc7f3eb42
live register for health personnel and infrastructure|accurate data about the quantity and geospatial location of its manpower|Having accurate data about the quantity and geospatial location of its manpower will increase the efficiency and effectiveness of its utilization.|8c7d4038a578437e8b1ddf7cc7f3eb42
well-equipped personnel|services they have been trained for|Those trained to provide them must be well-equipped to provide the services they have been trained for.|fbd7d1cfd0dc411fa9b3d77744e1d643
transparency in creating training schedules|erratic posting of personnel|Lack of transparency in creating training schedules, coupled with the erratic posting of personnel, all too often results in the same personnel staying at district or state headquarters, where living conditions are generally better than in the underserved regions.|fbd7d1cfd0dc411fa9b3d77744e1d643
online training|adoption|It must be adopted.|fbd7d1cfd0dc411fa9b3d77744e1d643
infrastructure|online training|This will require investment in the necessary infrastructure to do so.|fbd7d1cfd0dc411fa9b3d77744e1d643
training initiative|upgrading skills of nurses|A two-year intermittent training initiative for upgrading the skills of nurses was taken by faculty from the University of Nottingham in India.|fbd7d1cfd0dc411fa9b3d77744e1d643
evaluations|training|The training received positive evaluations from participants,|fbd7d1cfd0dc411fa9b3d77744e1d643
deeper structural problems|training|but few implemented what was learned due to deeper structural problems including national and state-level policies, working conditions, and staff shortages [52].|fbd7d1cfd0dc411fa9b3d77744e1d643
communities|sourcing health personnel|Sourcing health personnel who are native residents of the communities,|fbd7d1cfd0dc411fa9b3d77744e1d643
clinical and social skills|providing ongoing training|providing ongoing training in clinical and social skills,|fbd7d1cfd0dc411fa9b3d77744e1d643
work environment|non-hierarchical work environment|using a non-hierarchical work environment,|fbd7d1cfd0dc411fa9b3d77744e1d643
individualized mentoring|personnel retention|providing individualized mentoring help personnel retention and ensure personnel motivation [53].|fbd7d1cfd0dc411fa9b3d77744e1d643
increasing violence against healthcare personnel|a worrisome new trend|This trend of increasing violence against healthcare personnel is a cause for concern.|640835e2521045a395ab6465cc1ba4ca
increasing violence against healthcare personnel|a bad situation|The trend of increasing violence against healthcare personnel adds to the already bad situation in healthcare.|640835e2521045a395ab6465cc1ba4ca
low physician-to-patient ratio|results in delays in attending patients|A low physician-to-patient ratio leads to delays in attending patients.|640835e2521045a395ab6465cc1ba4ca
underpaid physicians|tempted to take on more patients than they can reasonably serve|Underpaid physicians are tempted to take on more patients than they can reasonably serve.|640835e2521045a395ab6465cc1ba4ca
defensive medicine practices|set in|Defensive medicine practices set in because of overwhelmed physicians.|640835e2521045a395ab6465cc1ba4ca
overwhelmed physicians|protect themselves by ordering unnecessary tests and procedures|Overwhelmed physicians protect themselves by ordering unnecessary tests and procedures.|640835e2521045a395ab6465cc1ba4ca
unethical practices by pharmaceutical companies|[54]|Unethical practices by pharmaceutical companies, as mentioned in [54],|640835e2521045a395ab6465cc1ba4ca
intense focus on specialization|[55]|An intense focus on specialization, as mentioned in [55],|640835e2521045a395ab6465cc1ba4ca
primary care physicians|adequately compensated|Until and unless primary care physicians are adequately compensated,|640835e2521045a395ab6465cc1ba4ca
private marketplace|will not be able to solve this|The private marketplace will not be able to solve this issue.|640835e2521045a395ab6465cc1ba4ca
thoughtful approach to government planning|can reverse the situation|Only a thoughtful approach to government planning can reverse the situation.|640835e2521045a395ab6465cc1ba4ca
affordable, accessible, quality care|health system|In order to provide affordable, accessible, and quality care for its citizens, it is essential to ensure the overall efficiency of India's health system.|cc477f702dc84fb3877fe06eada81dc1
transparency|recommendations made here|The recommendations made here are an effort to promote transparency in the synergization process between the public and private health sector services for maximizing efficiencies at scale.|cc477f702dc84fb3877fe06eada81dc1
training|health personnel|Focus on training and retaining health personnel is essential to ensure India’s health system is able to provide affordable, accessible, quality care for its citizens.|cc477f702dc84fb3877fe06eada81dc1
retaining|health personnel|Retaining health personnel is crucial in the synergization process between the public and private health sector services for maximizing efficiencies at scale.|cc477f702dc84fb3877fe06eada81dc1
strengthening|health infrastructure|Strengthening health infrastructure is essential to ensure India’s health system is able to provide affordable, accessible, quality care for its citizens.|cc477f702dc84fb3877fe06eada81dc1
uniform standards|implementation|Implementing uniform standards is crucial in the synergization process between the public and private health sector services for maximizing efficiencies at scale.|cc477f702dc84fb3877fe06eada81dc1
policy|overarching|A broad overarching policy is essential to ensure India’s health system is able to provide affordable, accessible, quality care for its citizens and synergize the services between the public and private health sector.|cc477f702dc84fb3877fe06eada81dc1
service provision|public health sector|The aims and service provision by the public health sector are different, and they should be synergized with the private health sector services for maximizing efficiencies at scale.|cc477f702dc84fb3877fe06eada81dc1
service provision|private health sector|The aims and service provision by the private health sector are different, and they should be synergized with the public health sector services for maximizing efficiencies at scale.|cc477f702dc84fb3877fe06eada81dc1
